{
  "schema_version": 1,
  "artifact_kind": "pooleos_native_policy_golden_vectors",
  "contract_id": "PPOL1",
  "vectors": [
    {
      "id": "canonical",
      "bytes": 1984,
      "sha256": "511A9B46FC461DA3BBF48831BC22870422B30EF94F898BB874BFAB4BF4E3CEA0",
      "hex": "50504F4C31000000010000000002800040000100FFFF3F000100000000000000010000000000000006000B003F00000000020000000000000005000000000000C0070000000000000010000001000000FFFF0000000000000000000000000000E6976539E72D32974918B2ABA7AB53043AB44AB478D8CBA0ABF9E30E66869F89FFE7243CEE75963D84905E6C9BF9F0D04310EEDBF097757C32E0EBE30FA0C3EDBA63DF2A44AD51EBEEDBE3F05D2D4D13FAF68CF6A2024A7DE355A86A4D0D666C48534BFDED3888201BA668B58891AFD8ED1EB1470E1334FF2E7A4F737C8A1574D1EF85112EC9834E972C7CC49892B3CE81FE3464F1D143A94DBE37D59843ACE60057FAC6ACBEE3E1BE3A71BB20CF26155DA343010380D07631328D640F4090A5F8B6D491A28D72E3C9B36FAB5B24D446FBD67CD760A9A8B05C7774EB3A691DE5918BA369EFDF92040C9CB2C03C9C3FBBC22C5BABD73A727B811F44F2B46B9ED2A1108D3E684AA401095A5B68882E6BEB814003E3D992F17ACAE6C05305CD5ADF155842A73F2031D7DB3CC769A4458BA075646C5924F973D73B6AD1E6E9A576E6A7ED76DED0DAAC7C182FD036111CD73E27B029F7D545FA1FC5E136D409DE8B93504F4F4C454F532D504F4C4943592D4359434C45313133000000000000000000000000000000000000000000000000000000000000000000000000000000000001000F000B000000FF00000000000000FFCF03000000000000FF0000000000000000010000040000001000004000000000000000000100000F0000001F0000007C0000003F0000003F0000000000000001000000000000000000000000000000000000000000000000000000000000000000000000000000000000000000000002005F000B000000B700000000000000FFCF03000000000048FF00000000000000200000800000000002000008000000000000000000000009000000070000007C0000000B0000003F0000000000000001000000000000000000000000000000000000000000000000000000000000000000000000000000000000000000000003004F000B000000BF00000000000000FFCF03000000000040FF0000000000000080000000020000000800002000000000000000000000000F0000000F0000007C0000000F0000003F000000000000000100000000000000000000000000000000000000000000000000000000000000000000000000000000000000000000000400EF0000000000BF80000000000000FFCF030000000000407F00000000000000100000400000000001000004000000000000000000000000000000000000007C0000000B0000003F0000000000000001000000000000000000000000000000000000000000000000000000000000000000000000000000000000000000000005004F000B000000B702000000000000FFCF03000000000048FD00000000000000400000000100000004000008000000000000000000000009000000070000007C0000001A0000003F0000000000000001000000000000000000000000000000000000000000000000000000000000000000000000000000000000000000000006004F030000000007B0000000000000FFFF030000000000F84F00000000000000080000200000008000000001000000000000000000000000000000000000007C000000280000003F00000000000000010000000000000000000000000000000000000000000000000000000000000000000000000000000000000000000000010000000000000001000000010000000F000000000000000F000000000000000B0000000B000000010000001700000006000000000000000100080001000000020000000000000001000000020000000F000000000000000F000000000000000B0000000B000000020000001700000016000000000000000100080001000000030000000000000001000000030000000F000000000000000F000000000000000B0000000B0000000300000017000000260000000000000001000800010000000400000001000000020000000100000007000000000000000700000000000000090000000900000001000000170000000600000000000000010000000100000005000000010000000300000001000000070000000000000007000000000000000900000009000000010000001700000006000000000000000100000001000000060000000200000002000000020000000E000000000000000E000000000000000900000009000000020000001700000014000000000000000100000001000000070000000200000003000000020000000E000000000000000E00000000000000090000000900000002000000170000001400000000000000010000000100000008000000030000000200000003000000070000000000000007000000000000000900000009000000030000001700000026000000000000000100000001000000090000000300000003000000030000000700000000000000070000000000000009000000090000000300000017000000260000000000000001000000010000000A000000000000000200000004000000020000000000000002000000000000000B0000000B0000000400000017000000010000000000000002000200010000000B0000000A0000000300000004000000020000000000000002000000000000000900000009000000040000001700000001000000000000000200000001000000",
      "summary": {
        "contract_id": "PPOL1",
        "version": "1.0",
        "policy_version": 1,
        "policy_id": "POOLEOS-POLICY-CYCLE113",
        "bytes": 1984,
        "mode_count": 6,
        "capability_rule_count": 11,
        "body_sha256": "A7ED76DED0DAAC7C182FD036111CD73E27B029F7D545FA1FC5E136D409DE8B93",
        "initial_system_sha256": "FFE7243CEE75963D84905E6C9BF9F0D04310EEDBF097757C32E0EBE30FA0C3ED",
        "qualification_only": true
      }
    },
    {
      "id": "minimal",
      "bytes": 1344,
      "sha256": "7BF816A2242526E518378777BBE8695F38D0D579FB9C0F480C516D147B6594DD",
      "hex": "50504F4C31000000010000000002800040000100FFFF3F0001000000000000000100000000000000060001003F0000000002000000000000000500000000000040050000000000000100000001000000FFFF0000000000000000000000000000E1E0644017A85C8D160307C6CBBE2CC46686AD310DCDC1AE3EA7E0CB0A4DA23864D6824CA0B1E43F4BE09ADB9AF096FDD8F920BE94AB564C192F05708D654168114B887D297629BD0A934D284875B6529982EA7D89C5CA18D82B6A5A121E1031D356743BFE53EDA6BCEFB80C375DC6DCF4CF0568CBF941629DE07E91C21F01265932BB8CBE6DD664278E3E63D20703322A1A24211D686408A38DDD41D7627568F9BEC06CF71495E4EABAFDA965218B8BEEF8F0FF2F7E1A3C3BF0664927A64C0C5EC763822379C707DB4B90467AF1BE50CDB849EDD07FABC15EF228D7EB68933D581D3C8F6383A659961BC582478B83C32DBC9351645FD2B8D39A117C25C017D63CE55026FB190558540F5827F947E5CCC2150E70DEAC714739EF58B50193AAC9D34D7C582C2B6F017FD81DEFAFEB188E62601B1296C5184CE17A603940ED56D546AB5E9ABF2DD4D66840D3EF7C0FEBA6DB9A542C85701D08E631D80483D7CB1D50504F4C312D4D494E494D414C00000000000000000000000000000000000000000000000000000000000000000000000000000000000000000000000000000001000F0001000000FF00000000000000FFCF03000000000000FF0000000000000000010000040000001000004000000000000000000100000F0000001F0000007C0000003F0000003F0000000000000001000000000000000000000000000000000000000000000000000000000000000000000000000000000000000000000002005F0001000000B700000000000000FFCF03000000000048FF00000000000000200000800000000002000008000000000000000000000009000000070000007C0000000B0000003F0000000000000001000000000000000000000000000000000000000000000000000000000000000000000000000000000000000000000003004F0001000000BF00000000000000FFCF03000000000040FF0000000000000080000000020000000800002000000000000000000000000F0000000F0000007C0000000F0000003F000000000000000100000000000000000000000000000000000000000000000000000000000000000000000000000000000000000000000400EF0000000000BF80000000000000FFCF030000000000407F00000000000000100000400000000001000004000000000000000000000000000000000000007C0000000B0000003F0000000000000001000000000000000000000000000000000000000000000000000000000000000000000000000000000000000000000005004F0001000000B702000000000000FFCF03000000000048FD00000000000000400000000100000004000008000000000000000000000009000000070000007C0000001A0000003F0000000000000001000000000000000000000000000000000000000000000000000000000000000000000000000000000000000000000006004F030000000007B0000000000000FFFF030000000000F84F00000000000000080000200000008000000001000000000000000000000000000000000000007C000000280000003F0000000000000001000000000000000000000000000000000000000000000000000000000000000000000000000000000000000000000001000000000000000100000001000000010000000000000001000000000000000900000009000000010000001700000002000000000000000100000001000000",
      "summary": {
        "contract_id": "PPOL1",
        "version": "1.0",
        "policy_version": 1,
        "policy_id": "PPOL1-MINIMAL",
        "bytes": 1344,
        "mode_count": 6,
        "capability_rule_count": 1,
        "body_sha256": "46AB5E9ABF2DD4D66840D3EF7C0FEBA6DB9A542C85701D08E631D80483D7CB1D",
        "initial_system_sha256": "64D6824CA0B1E43F4BE09ADB9AF096FDD8F920BE94AB564C192F05708D654168",
        "qualification_only": true
      }
    },
    {
      "id": "boundary",
      "bytes": 17664,
      "sha256": "82C585EDCDBF05E57C6D328606867F023E55FA3A21992CBB1B9CD664F7F4FB31",